url,name,address,city,state,phone
https://olsencpa.com/,Olsen & Webster CPA‚Äôs & Advisors,"ÓÉą132 SW 5th Ave #100, Meridian, ID 83642",Meridian,ID,Óāį(208) 888-1595
http://www.leahsaccountingsolutions.com/,"Leah‚Äôs Accounting Solutions, PC","ÓÉą91 Taylor Ln, St Maries, ID 83861",St Maries,ID,Óāį(208) 245-0930
http://treasurevalleycpa.com/,Treasure Valley CPA,"ÓÉą119 E Calderwood Dr #101, Meridian, ID 83642",Meridian,ID,Óāį(208) 322-0720
http://genesisaccountingpllc.com/,Genesis Certified Public Accounting,,Viola,ID,Óāį(208) 856-8222
https://www.lammcocpa.com/,Lamm & Company CPA,"ÓÉą311 Deinhard Ln, McCall, ID 83638",McCall,ID,Óāį(208) 634-2351
https://alpinesummit.cpa/,Alpine Summit CPAs,"ÓÉą1810 E Schneidmiller Ave # 310, Post Falls, ID 83854",Post Falls,ID,Óāį(208) 777-1099
http://www.mygreatcpa.com/,Johannsen CPA,"ÓÉą1800 W Ardell Rd, Kuna, ID 83634",Kuna,ID,Óāį(208) 922-9080
https://www.vilenskyco.com/,"Vilensky & Company, LLC","ÓÉą613 4th St, Kamiah, ID 83536",Kamiah,ID,Óāį(208) 935-1040
http://idahotaxpros.com/,Christensen & Hobbs,"ÓÉą203 S Garfield Ave, Pocatello, ID 83204",Pocatello,ID,Óāį(208) 238-8829
https://www.aarwcpa.com/,Arritt Robins Waters Cpas,"ÓÉą1734 Overland Ave, Burley, ID 83318",Burley,ID,Óāį(208) 678-9014
https://westviewcpa.com/,Results,,Viola,ID,Óāį(208) 446-5523
https://mmd.cpa/,Results,"ÓÉą2100 Northwest Blvd, Coeur d'Alene, ID 83814",Coeur d'Alene,ID,Óāį(208) 765-9500
http://www.nailcpa.com/,Results,"ÓÉą618 N 4th St, Coeur d'Alene, ID 83814",Coeur d'Alene,ID,Óāį(208) 765-1091
http://cdaaccounting.com/,Results,"ÓÉą610 Hubbard Ave #201, Coeur d'Alene, ID 83814",Coeur d'Alene,ID,Óāį(208) 415-1850
http://www.summitviewcpas.com/,Results,"ÓÉą1446 W Ustick Rd Suite 120, Meridian, ID 83646",Meridian,ID,Óāį(208) 401-0141
http://www.cda.cpa/,Results,"ÓÉą618 N 4th St, Coeur d'Alene, ID 83814",Coeur d'Alene,ID,Óāį(208) 765-1091
